{
  "version": 1,
  "authority": "Product owner retains final authority; GitHub controls enforce approval, merge, and deployment.",
  "requiredCapabilities": [
    "requirements-governance",
    "architecture",
    "implementation",
    "quality-assurance",
    "security-review",
    "operational-readiness",
    "documentation",
    "deterministic-verification",
    "independent-review",
    "orchestration"
  ],
  "agents": [
    {
      "id": "product-requirements-analyst",
      "name": "Product and Requirements Analyst",
      "lifecycle": "core",
      "definitionPath": ".github/agents/product-requirements.agent.md",
      "capabilities": [
        "requirements-governance",
        "traceability",
        "gap-analysis"
      ],
      "prohibitions": ["invent-requirements", "approve-own-work"],
      "activationGate": ""
    },
    {
      "id": "mvp-engineering-orchestrator",
      "name": "MVP Engineering Orchestrator",
      "lifecycle": "core",
      "definitionPath": ".github/agents/mvp-orchestrator.agent.md",
      "capabilities": ["orchestration", "routing", "handoff-coordination"],
      "prohibitions": ["approve", "merge", "deploy", "bypass-human-gate"],
      "activationGate": ""
    },
    {
      "id": "solution-architect",
      "name": "Solution Architect",
      "lifecycle": "core",
      "definitionPath": ".github/agents/solution-architect.agent.md",
      "capabilities": [
        "architecture",
        "contract-impact",
        "technical-decisions"
      ],
      "prohibitions": ["approve-own-implementation", "change-product-scope"],
      "activationGate": ""
    },
    {
      "id": "qa-test-engineer",
      "name": "QA and Test Engineer",
      "lifecycle": "core",
      "definitionPath": ".github/agents/qa-test-engineer.agent.md",
      "capabilities": [
        "quality-assurance",
        "acceptance-testing",
        "regression-testing"
      ],
      "prohibitions": ["weaken-tests", "approve-own-implementation"],
      "activationGate": ""
    },
    {
      "id": "security-privacy-reviewer",
      "name": "Security and Privacy Reviewer",
      "lifecycle": "core",
      "definitionPath": ".github/agents/security-privacy-reviewer.agent.md",
      "capabilities": ["security-review", "privacy-review", "threat-modeling"],
      "prohibitions": ["approve-own-remediation", "expose-sensitive-data"],
      "activationGate": ""
    },
    {
      "id": "harness-evaluation-engineer",
      "name": "Harness and Evaluation Engineer",
      "lifecycle": "core",
      "definitionPath": ".github/agents/harness-evaluation-engineer.agent.md",
      "capabilities": [
        "deterministic-verification",
        "evidence-governance",
        "policy-validation"
      ],
      "prohibitions": [
        "suppress-failure",
        "fabricate-evidence",
        "approve-own-policy"
      ],
      "activationGate": ""
    },
    {
      "id": "pull-request-reviewer",
      "name": "Pull Request Reviewer",
      "lifecycle": "core",
      "definitionPath": ".github/agents/pull-request-reviewer.agent.md",
      "capabilities": [
        "independent-review",
        "scope-review",
        "maintainability-review"
      ],
      "prohibitions": ["approve-own-implementation", "expand-scope"],
      "activationGate": ""
    },
    {
      "id": "backend-engineer",
      "name": "Backend Engineer",
      "lifecycle": "on-demand",
      "definitionPath": ".github/agents/backend-engineer.agent.md",
      "capabilities": ["implementation", "api", "authorization"],
      "prohibitions": ["direct-ai-database-access", "approve-own-work"],
      "activationGate": "approved-task-contract"
    },
    {
      "id": "frontend-engineer",
      "name": "Frontend Engineer",
      "lifecycle": "on-demand",
      "definitionPath": ".github/agents/frontend-engineer.agent.md",
      "capabilities": ["implementation", "web", "accessibility"],
      "prohibitions": ["direct-database-access", "duplicate-financial-rules"],
      "activationGate": "approved-task-contract"
    },
    {
      "id": "data-database-engineer",
      "name": "Data and Database Engineer",
      "lifecycle": "on-demand",
      "definitionPath": ".github/agents/data-database-engineer.agent.md",
      "capabilities": ["implementation", "database", "data-integrity"],
      "prohibitions": [
        "destructive-migration-without-approval",
        "edit-posted-history"
      ],
      "activationGate": "approved-task-contract"
    },
    {
      "id": "ux-ui-product-designer",
      "name": "UX UI Product Designer",
      "lifecycle": "on-demand",
      "definitionPath": ".github/agents/ux-ui-designer.agent.md",
      "capabilities": ["product-design", "accessibility", "interaction-design"],
      "prohibitions": ["invent-journeys", "change-requirements"],
      "activationGate": "approved-task-contract"
    },
    {
      "id": "azure-platform-sre-engineer",
      "name": "Azure Platform and SRE Engineer",
      "lifecycle": "on-demand",
      "definitionPath": ".github/agents/azure-platform-sre.agent.md",
      "capabilities": [
        "operational-readiness",
        "infrastructure",
        "incident-support"
      ],
      "prohibitions": ["deploy-production", "invent-slo", "approve-own-change"],
      "activationGate": "approved-task-contract"
    },
    {
      "id": "technical-writer-documentation-steward",
      "name": "Technical Writer and Documentation Steward",
      "lifecycle": "on-demand",
      "definitionPath": ".github/agents/technical-writer.agent.md",
      "capabilities": [
        "documentation",
        "documentation-drift",
        "runbook-documentation"
      ],
      "prohibitions": ["invent-product-behavior", "duplicate-authority"],
      "activationGate": "approved-task-contract"
    },
    {
      "id": "brand-identity-designer",
      "name": "Brand Identity Designer",
      "lifecycle": "deferred",
      "capabilities": ["brand-design"],
      "prohibitions": ["change-requirements", "activate-without-approval"],
      "activationGate": "product-owner-approved-registry-transition"
    },
    {
      "id": "legal-regulatory-reviewer",
      "name": "Legal and Regulatory Reviewer",
      "lifecycle": "deferred",
      "capabilities": ["legal-review"],
      "prohibitions": [
        "make-legal-claims",
        "activate-without-qualified-review"
      ],
      "activationGate": "product-owner-approved-registry-transition"
    },
    {
      "id": "financial-operations-agent",
      "name": "Financial Operations Agent",
      "lifecycle": "deferred",
      "capabilities": ["financial-operations"],
      "prohibitions": [
        "move-money",
        "edit-posted-history",
        "activate-without-approval"
      ],
      "activationGate": "product-owner-approved-registry-transition"
    },
    {
      "id": "product-analytics-experimentation-agent",
      "name": "Product Analytics and Experimentation Agent",
      "lifecycle": "deferred",
      "capabilities": ["product-analytics"],
      "prohibitions": ["run-unapproved-experiment", "use-sensitive-labels"],
      "activationGate": "product-owner-approved-registry-transition"
    },
    {
      "id": "localization-internationalization-agent",
      "name": "Localization and Internationalization Agent",
      "lifecycle": "deferred",
      "capabilities": ["localization"],
      "prohibitions": ["invent-legal-copy", "change-requirements"],
      "activationGate": "product-owner-approved-registry-transition"
    },
    {
      "id": "customer-support-knowledge-agent",
      "name": "Customer Support and Knowledge Agent",
      "lifecycle": "deferred",
      "capabilities": ["customer-support"],
      "prohibitions": ["access-raw-sensitive-data", "take-account-action"],
      "activationGate": "product-owner-approved-registry-transition"
    },
    {
      "id": "fraud-trust-agent",
      "name": "Fraud and Trust Agent",
      "lifecycle": "deferred",
      "capabilities": ["fraud-review"],
      "prohibitions": [
        "autonomous-denial",
        "autonomous-eviction",
        "move-money"
      ],
      "activationGate": "product-owner-approved-registry-transition"
    },
    {
      "id": "performance-capacity-engineer",
      "name": "Performance and Capacity Engineer",
      "lifecycle": "deferred",
      "capabilities": ["performance-capacity"],
      "prohibitions": [
        "paid-scaling-without-approval",
        "change-architecture-without-adr"
      ],
      "activationGate": "product-owner-approved-registry-transition"
    },
    {
      "id": "native-mobile-engineer",
      "name": "Native Mobile Engineer",
      "lifecycle": "deferred",
      "capabilities": ["native-mobile"],
      "prohibitions": ["invent-mobile-journeys", "bypass-api"],
      "activationGate": "product-owner-approved-registry-transition"
    },
    {
      "id": "marketplace-partner-integration-agent",
      "name": "Marketplace and Partner Integration Agent",
      "lifecycle": "deferred",
      "capabilities": ["partner-integration"],
      "prohibitions": ["share-unapproved-data", "commit-credentials"],
      "activationGate": "product-owner-approved-registry-transition"
    },
    {
      "id": "data-platform-bi-agent",
      "name": "Data Platform and BI Agent",
      "lifecycle": "deferred",
      "capabilities": ["data-platform"],
      "prohibitions": ["production-export", "create-shadow-source-of-truth"],
      "activationGate": "product-owner-approved-registry-transition"
    },
    {
      "id": "ai-feature-model-governance-agent",
      "name": "AI Feature and Model-Governance Agent",
      "lifecycle": "deferred",
      "capabilities": ["ai-model-governance"],
      "prohibitions": [
        "direct-database-access",
        "autonomous-high-impact-action",
        "unevaluated-release"
      ],
      "activationGate": "product-owner-approved-registry-transition"
    }
  ]
}
